{
  "$schema": "../../.specify/schemas/e2e-phases.schema.json",
  "schema_version": 1,
  "feature_key": "e2e-default-branch-and-production-promotion-classification",
  "title": "E2E default-branch and protected Production promotion classification",
  "delivery_mode": "single_pr",
  "current_phase": "mvp",
  "scope": {
    "include": [
      ".changes/e2e/e2e-default-branch-and-production-promotion-classification.json",
      "http-generic-api/scripts/e2e-parallel-pr-flow-self-test.mjs",
      "http-generic-api/scripts/e2e-production-promotion-bridge-self-test.mjs",
      "http-generic-api/scripts/e2e-parallel-pr-gate.mjs",
      "http-generic-api/test-governed-generated-artifact-refresh-pr-target-bridge.mjs",
      "http-generic-api/test-hostinger-storage-durable-authorized-injection-schema-ddl-workflow.mjs"
    ]
  },
  "merge_contract": {
    "minimum_phase": "mvp"
  },
  "phases": [
    {
      "id": "mvp",
      "status": "implemented",
      "objective": "Classify trusted default-branch execution, declared parallel pull requests, and governed Production promotions without inheriting unrelated pull-request identity or weakening fail-closed branch rules, including canonical source-pinned dispatch-bridge identity, bridge-only bounded zero-diff human re-arm successors, authenticated read-only protected-ref lookup for callers that intentionally do not persist Git credentials, and the Hostinger DDL workflow regression that proves the caller wiring.",
      "e2e_journeys": [
        {
          "id": "classify-default-branch-parallel-pr-and-governed-production-promotions",
          "end_to_end": true,
          "level": "synthetic_runtime",
          "actor": "E2E Phase Governance runner",
          "entrypoint": "The classifier self-tests invoke the canonical E2E PR gate in isolated synthetic Git contexts, including a fake authenticated GitHub API transport, while the Hostinger workflow regression proves the ephemeral read-token caller contract.",
          "terminal_outcome": "Default-branch/manual execution is standard, declared workstreams retain bounded classification, undeclared PR branches fail closed, SHA-bound Production identities remain exact-head, canonical bridge-pinned candidates may retain identity through bounded zero-diff re-arm successors, and private-repository callers can verify live protected refs without persisting Git credentials. Legacy SHA-bound candidates retain a local-main fallback when the remote-tracking main ref is unavailable, without weakening governed dispatch-bridge live-ref requirements.",
          "steps": [
            "Create synthetic repository baselines and bind local and remote main refs.",
            "Remove inherited pull-request base/head environment variables for the default-branch fixture.",
            "Invoke the canonical gate for main without a PR base ref and require standard mode.",
            "Invoke the gate for an undeclared branch with an Integration base and require bounded rejection.",
            "Retain workstream-to-Integration enforcement and direct workstream-to-main rejection.",
            "Retain exact main-to-Production and immutable main-snapshot promotion acceptance with spoof rejection.",
            "Accept a SHA-bound reconciliation candidate only when the current head itself matches the SHA-bound identity and is the exact two-parent main/Production reconciliation whose tree equals current main.",
            "When the remote-tracking main ref is absent but refs/heads/main is valid, retain local-main fallback only for legacy SHA-bound classification and keep governed dispatch-bridge classification strict.",
            "Reject a zero-diff successor on a SHA-bound release ref when the successor head no longer matches the SHA-bound identity.",
            "Accept the governed dispatch-bridge branch only when its embedded main and Production prefixes match the live protected refs and the current head resolves through no more than four identical-tree single-parent re-arm commits to the exact two-parent reconciliation anchor.",
            "When an explicit read-only ref-lookup token is provided, resolve live protected SHAs through the authenticated GitHub API without persisting Git credentials or placing the token in command arguments.",
            "If the authenticated protected-ref lookup fails, fail closed without falling back to an unauthenticated Git remote lookup; retain git ls-remote only for tokenless synthetic or local execution.",
            "Execute the Hostinger DDL workflow regression and require persist-credentials false plus the ephemeral github.token protected-ref lookup binding.",
            "Preserve phase evaluation against the pinned main parent rather than a zero-diff bridge re-arm commit.",
            "Reject bridge identities with wrong protected-ref pins, mutated re-arm trees, malformed identities, malformed reconciliation ancestry, or unavailable authenticated live-ref evidence."
          ],
          "assertions": [
            "Default-branch/manual execution does not inherit enclosing pull-request identity.",
            "The undeclared-branch guard executes only when a pull-request base ref exists.",
            "Declared workstream and Integration rules remain fail closed.",
            "Merge-queue refs remain excluded from ordinary PR classification.",
            "SHA-bound immutable snapshots and reconciliations remain exact-head identities and do not inherit bridge re-arm traversal semantics.",
            "Canonical dispatch-bridge reconciliations may use bounded identical-tree re-arms only after their live protected-ref and ancestry identity checks succeed.",
            "Authenticated protected-ref readback uses only an ephemeral read token supplied through the child environment, never Git credential persistence, CLI token arguments, repository mutation, or evidence payloads.",
            "The Hostinger DDL workflow regression remains part of this implemented classifier journey because it proves the private-repository caller wiring without persisting Git credentials.",
            "Failure of the explicitly selected authenticated transport cannot silently fall back to another authority source.",
            "A bridge branch cannot substitute stale or spoofed main/Production prefixes, and a bridge re-arm cannot mutate the candidate tree.",
            "No repository write, protected-ref update, deployment, provider call, SQL, migration Apply, database mutation, or external send occurs.",
            "secrets_included is false.",
            "Legacy SHA-bound candidates may use refs/heads/main only when origin/main is unavailable; governed dispatch bridges still require the canonical remote main plus live protected-ref verification."
          ],
          "tests": [
            {
              "id": "e2e-parallel-pr-flow-self-test",
              "runner": "node",
              "working_directory": "http-generic-api",
              "path": "scripts/e2e-parallel-pr-flow-self-test.mjs",
              "args": []
            },
            {
              "id": "e2e-production-promotion-bridge-self-test",
              "runner": "node",
              "working_directory": "http-generic-api",
              "path": "scripts/e2e-production-promotion-bridge-self-test.mjs",
              "args": []
            },
            {
              "id": "hostinger-storage-durable-authorized-injection-schema-ddl-workflow-regression",
              "runner": "node",
              "working_directory": "http-generic-api",
              "path": "test-hostinger-storage-durable-authorized-injection-schema-ddl-workflow.mjs",
              "args": []
            }
          ],
          "evidence_paths": [
            ".changes/e2e/e2e-default-branch-and-production-promotion-classification.json",
            "http-generic-api/scripts/e2e-parallel-pr-flow-self-test.mjs",
            "http-generic-api/scripts/e2e-production-promotion-bridge-self-test.mjs",
            "http-generic-api/scripts/e2e-parallel-pr-gate.mjs",
            "http-generic-api/test-hostinger-storage-durable-authorized-injection-schema-ddl-workflow.mjs"
          ]
        }
      ]
    },
    {
      "id": "operational",
      "status": "planned",
      "objective": "Observe the classifier across protected pull requests, workflow dispatches, default-branch runs, immutable Production release snapshots, and canonical dispatch-bridge candidates using structured E2E evidence."
    },
    {
      "id": "resilient",
      "status": "planned",
      "objective": "Retain bounded diagnostics for inherited environment variables, missing refs, authenticated lookup failures, spoofed identities, stale SHAs, wrong trees, wrong parent order, wrong Production bases, extra reconciliation parents, excessive bridge re-arm depth, and empty-diff malformed candidates."
    },
    {
      "id": "canary",
      "status": "planned",
      "objective": "Validate one non-production default-branch/manual run, one declared parallel pull-request flow, one immutable Production snapshot, one exact SHA-bound reconciliation with zero-diff successor rejection, one canonical bridge reconciliation with authenticated protected-ref readback and zero-diff re-arm, one Hostinger caller-wiring regression, and explicit fail-closed Production rejection."
    },
    {
      "id": "production",
      "status": "planned",
      "objective": "Require exact classifier evidence for protected main-to-Production, immutable main-snapshot, exact SHA-bound reconciliation, and canonical dispatch-bridge promotion identities without granting merge or deployment authority."
    }
  ],
  "secrets_included": false
}
