{
  "$schema": "../../.specify/schemas/e2e-phases.schema.json",
  "schema_version": 1,
  "feature_key": "support-ticket-runtime-openapi-completeness",
  "title": "Support Ticket runtime and OpenAPI operation completeness",
  "delivery_mode": "single_pr",
  "current_phase": "operational",
  "scope": {
    "include": [
      ".changes/e2e/support-ticket-runtime-openapi-completeness.json",
      "http-generic-api/scripts/support-ticket-runtime-openapi-contracts.mjs",
      "http-generic-api/scripts/openapi-precise-contract-registry-sync.mjs",
      "http-generic-api/test-support-ticket-runtime-openapi-sync.mjs",
      "http-generic-api/openapi.yaml",
      "http-generic-api/frontend-surface-dispatch.generated.json",
      "http-generic-api/openapi/frontend-runtime-routes.generated.yaml",
      "http-generic-api/openapi-registry.json",
      "http-generic-api/frontend-capabilities.json",
      "http-generic-api/gpt-action-operations.json",
      "http-generic-api/gpt-actions.openapi.yaml",
      "gpt-actions.openapi.yaml"
    ]
  },
  "merge_contract": {
    "minimum_phase": "mvp"
  },
  "phases": [
    {
      "id": "mvp",
      "status": "implemented",
      "objective": "Compose every exact Support Ticket and Tenant Request runtime operation into the reviewed root OpenAPI contract with fail-closed authentication, path, operation identifier, response, and consequential metadata.",
      "e2e_journeys": [
        {
          "id": "compose-complete-support-ticket-runtime-contracts",
          "end_to_end": true,
          "level": "synthetic_runtime",
          "actor": "OpenAPI maintenance runner and authenticated Support Ticket clients",
          "entrypoint": "The precise contract registry sync reads routes/supportTicketRoutes.js before the missing-route coverage gate.",
          "terminal_outcome": "Every unique runtime method and normalized path is either bound to an existing reviewed path-item reference or represented by a deterministic source-bound OpenAPI operation, while ambiguous authorization and partial path coverage fail closed.",
          "steps": [
            "Extract every literal Express method and path from the Support Ticket route source.",
            "Normalize Express path parameters to OpenAPI path parameters and deduplicate exact signatures.",
            "Bind requireUserJwt and requireTenantUserJwt routes to userJwtAuth.",
            "Bind adminGuards routes to alternative adminBearerAuth or backendApiKeyAuth requirements.",
            "Preserve existing precise path-item references and reject partial static path registration.",
            "Generate deterministic operation identifiers, summaries, parameters, responses, and consequential flags for uncovered operations.",
            "Run the governed generated-artifact writer on the exact non-protected branch head to update the root OpenAPI contract and the two bounded frontend/runtime-route indexes.",
            "Re-run the same synchronization in check mode and require zero missing paths, conflicts, or drift."
          ],
          "assertions": [
            "Every current Support Ticket runtime operation has an exact OpenAPI method and normalized path.",
            "Administrative operations declare adminBearerAuth and backendApiKeyAuth as alternatives.",
            "Tenant and member operations declare userJwtAuth.",
            "GET operations are non-consequential and mutation operations are consequential.",
            "Every path parameter is required and typed as a non-empty string.",
            "Operation identifiers are deterministic and collision-free.",
            "The governed writer changes only openapi.yaml, frontend-surface-dispatch.generated.json, and openapi/frontend-runtime-routes.generated.yaml beyond reviewed source and test files.",
            "An unknown or ambiguous runtime guard blocks synchronization.",
            "A partially registered path blocks synchronization rather than overwriting reviewed contracts.",
            "No runtime authorization, handler behavior, migration, SQL, deployment, provider, credential, external-send, protected-branch, or Production behavior changes."
          ],
          "tests": [
            {
              "id": "support-ticket-runtime-openapi-sync",
              "runner": "node",
              "working_directory": "http-generic-api",
              "path": "test-support-ticket-runtime-openapi-sync.mjs",
              "args": []
            },
            {
              "id": "openapi-autofill-missing-routes",
              "runner": "node",
              "working_directory": "http-generic-api",
              "path": "test-openapi-autofill-missing-routes.mjs",
              "args": []
            },
            {
              "id": "frontend-auth-openapi-parity",
              "runner": "node",
              "working_directory": "http-generic-api",
              "path": "test-frontend-auth-openapi-parity.mjs",
              "args": []
            }
          ],
          "evidence_paths": [
            "http-generic-api/scripts/support-ticket-runtime-openapi-contracts.mjs",
            "http-generic-api/scripts/openapi-precise-contract-registry-sync.mjs",
            "http-generic-api/test-support-ticket-runtime-openapi-sync.mjs",
            "http-generic-api/openapi.yaml",
            "http-generic-api/frontend-surface-dispatch.generated.json",
            "http-generic-api/openapi/frontend-runtime-routes.generated.yaml"
          ]
        }
      ]
    },
    {
      "id": "operational",
      "status": "implemented",
      "objective": "Prove that the governed generated-artifact writer refreshes the exact OpenAPI and downstream indexes on a reviewed gpt branch without source-file mutation.",
      "e2e_journeys": [
        {
          "id": "governed-support-ticket-openapi-refresh",
          "end_to_end": true,
          "level": "synthetic_runtime",
          "actor": "trusted generated-artifact dispatcher and governed writer",
          "entrypoint": "The trusted refresh command targets source head 7ab82718401b475d63bbc59d5458bb60d6ec1c3c on PR 4769.",
          "terminal_outcome": "Generated commit b28c3fa86a335cc3a909d22b73fc428145afb772 updates exactly three allowlisted artifacts and leaves runtime source, migrations, workflows, protected branches, and Production unchanged.",
          "steps": [
            "Validate the same-repository PR, exact expected source head, work-branch target, label, and typed confirmation.",
            "Run precise Support Ticket contract composition before missing-route autofill and downstream frontend generation.",
            "Verify OpenAPI route coverage, authentication parity, schema guards, and deterministic frontend dispatch generation.",
            "Commit and fast-forward push only the three registered generated artifact paths.",
            "Dispatch exact-result-head read-only verification."
          ],
          "assertions": [
            "The source head equals 7ab82718401b475d63bbc59d5458bb60d6ec1c3c.",
            "The generated result head equals b28c3fa86a335cc3a909d22b73fc428145afb772.",
            "The generated write-set is exactly openapi.yaml, frontend-surface-dispatch.generated.json, and openapi/frontend-runtime-routes.generated.yaml.",
            "No runtime source, migration, workflow, credential, provider, deployment, protected branch, or Production path changes.",
            "No force push is used and secrets_included remains false."
          ],
          "tests": [
            {
              "id": "support-ticket-runtime-openapi-sync-operational",
              "runner": "node",
              "working_directory": "http-generic-api",
              "path": "test-support-ticket-runtime-openapi-sync.mjs",
              "args": []
            },
            {
              "id": "frontend-auth-openapi-parity-operational",
              "runner": "node",
              "working_directory": "http-generic-api",
              "path": "test-frontend-auth-openapi-parity.mjs",
              "args": []
            }
          ],
          "evidence_paths": [
            ".changes/e2e/support-ticket-runtime-openapi-completeness.json",
            "http-generic-api/openapi.yaml",
            "http-generic-api/frontend-surface-dispatch.generated.json",
            "http-generic-api/openapi/frontend-runtime-routes.generated.yaml"
          ]
        }
      ]
    },
    {
      "id": "resilient",
      "status": "planned",
      "objective": "Exercise duplicate signatures, operation identifier collisions, unknown guards, partial static path registration, and authentication drift with stable blocking findings."
    },
    {
      "id": "canary",
      "status": "not_applicable",
      "objective": "This contract-generation repair performs no live provider or deployment canary."
    },
    {
      "id": "production",
      "status": "not_applicable",
      "objective": "This repair grants no migration, SQL, deployment, Production, provider, credential, external publication, or direct protected-branch authority."
    }
  ],
  "secrets_included": false
}
